<?xml version="1.0" encoding="utf-8"?> 
<ReportTemplate claspFooter="true" name="ElectionProtocol" 
                xmlns:xsi="http://www.w3.org/2001/XMLSchema-instance" xmlns="http://localhost/Schemas/SIB2003/ReportTemplate"
si:schemaLocation="http://localhost/Schemas/SIB2003/ReportTemplate ReportTemplate.xsd"> 
  <Parameters> 


    <Parameter>Election</Parameter> 


    <Parameter>withResults</Parameter> 
  </Parameters> 
  <Header> 
    <Line align="Left">–≠–∫–∑–µ–º–ø–ª—è—Ä ‚Ññ ___</Line> 
    <Line align="Center">{$@Election.Name}</Line> 
    <Line align="Center">{$ElectionManager.SourceData.ElectionDate|d MMMM yyyy –≥–æ–¥–∞}</Line> 
    <Line align="Center" bold="true">–ü–†–û–¢–û–ö–û–õ</Line> 
    <Line align="Center" split="\n" trim="true">{$@Election.Protocol.Name}</Line> 
    <Line align="Center">–ò–∑–±–∏—Ä–∞—Ç–µ–ª—å–Ω—ã–π —É—á–∞—Å—Ç–æ–∫ N{$ElectionManager.SourceData.Uik}</Line> 
  </Header> 
  <Body> 
    <Table> 
      <Header> 


        <Col width="3"/> 


        <Col width="65"/> 


        <Col width="4"/> 


        <Col width="28"/> 
      </Header> 
      <Body> 


        <For in="@Election.Protocol.Lines" each="Line"> 
          <Body> 
            <Line> 
              <Cols> 
                <Col>{$@Line.Num}{$@Line.AdditionalNum}</Col> 
                <Col>{$@Line.Name}</Col> 
                <Col> 
                  <Parts> 
                    <Part condition="@withResults">{$@Line.Value}</Part> 
                    <Part not="true" condition="@withResults">0</Part> 
                  </Parts> 
                </Col> 
                <Col> 
                  <Parts> 
                    <Part condition="@withResults">({$@Line.Value|#w})</Part> 
                    <Part not="true" condition="@withResults">(–Ω–æ–ª—å)</Part> 
                  </Parts> 
                </Col> 
              </Cols> 
            </Line> 
          </Body> 
        </For> 


        <SetCurrentRow>{$@Election.Protocol.LatestLineNumber}</SetCurrentRow> 


        <For in="@Election.Candidates" each="Candidate"> 
          <Body> 
            <If not="true" condition="@Candidate.Disabled"> 
              <Then> 


                <Line> 
                  <Cols> 
                    <Col>{$CurrentRow}</Col> 
                    <Col> 
                      <Parts> 
                        <Part condition="@Candidate.LastName">{$@Candidate.LastName|#u}</Part> 
                        <Part condition="@Candidate.FirstName"> {$@Candidate.FirstName}</Part> 
                        <Part condition="@Candidate.Patronymic"> {$@Candidate.Patronymic}</Part> 
                      </Parts> 
                    </Col> 
                    <Col> 
                      <Parts> 
                        <Part
ondition="@withResults">{$VotingResultManager.VotingResults.VotesCount&lt;$VoteKey.ctor&lt;;;;$@Candidate.Id;$@Election.ElectionId;&gt;&gt;}</Part> 
                        <Part not="true" condition="@withResults">0</Part> 
                      </Parts> 
                    </Col> 
                    <Col> 
                      <Parts> 
                        <Part
ondition="@withResults">({$VotingResultManager.VotingResults.VotesCount&lt;$VoteKey.ctor&lt;;;;$@Candidate.Id;$@Election.ElectionId;&gt;&gt;|#w})</Part> 
                        <Part not="true" condition="@withResults">(–Ω–æ–ª—å)</Part> 
                      </Parts> 
                    </Col> 
                  </Cols> 
                </Line> 
              </Then> 
              <Else> 


                <If condition="@Election.Protocol.DisabledString"> 
                  <Then> 


                    <Line> 
                      <Cols> 
                        <Col>{$CurrentRow}</Col> 
                        <Col> 
                          <Parts> 
                            <Part condition="@Candidate.LastName">{$@Candidate.LastName|#u}</Part> 
                            <Part condition="@Candidate.FirstName"> {$@Candidate.FirstName}</Part> 
                            <Part condition="@Candidate.Patronymic"> {$@Candidate.Patronymic}</Part> 
                          </Parts> 
                        </Col> 
                        <Col>{$@Election.Protocol.DisabledString}</Col> 
                        <Col/> 
                      </Cols> 
                    </Line> 
                  </Then> 
                </If> 
              </Else> 
            </If> 
          </Body> 
        </For> 
      </Body> 
    </Table> 
  </Body> 
  <PageFooter> 
            <Line align="Left"/> 
      <Line align="Left">–ü—Ä–µ–¥—Å–µ–¥–∞—Ç–µ–ª—å —É—á–∞—Å—Ç–∫–æ–≤–æ–π –∏–∑–±–∏—Ä–∞—Ç–µ–ª—å–Ω–æ–π –∫–æ–º–∏—Å—Å–∏–∏</Line> 
      <If not="true" condition="ElectionManager.SourceData.GetCommitteeMemberInitialByType&lt;Chairman&gt;"> 
        <Then> 
          <Line align="Right">______________________    _________________________________________</Line> 
        </Then> 
        <Else> 
          <Line align="Right">{$ElectionManager.SourceData.GetCommitteeMemberInitialByType&lt;Chairman&gt;}    _________________________________________</Line> 
        </Else> 
      </If> 
      <Line align="Right">(—Ñ–∞–º–∏–ª–∏—è, –∏–Ω–∏—Ü–∏–∞–ª—ã)                            (–ø–æ–¥–ø–∏—Å—å –ª–∏–±–æ –ø—Ä–∏—á–∏–Ω–∞ –æ—Ç—Å—É—Ç—Å—Ç–≤–∏—è,    </Line> 
      <Line align="Right">                                     –æ—Ç–º–µ—Ç–∫–∞ –æ–± –æ—Å–æ–±–æ–º –º–Ω–µ–Ω–∏–∏)         </Line> 
      <Line align="Left">–ó–∞–º–µ—Å—Ç–∏—Ç–µ–ª—å –ø—Ä–µ–¥—Å–µ–¥–∞—Ç–µ–ª—è –∫–æ–º–∏—Å—Å–∏–∏</Line> 
      <If not="true" condition="ElectionManager.SourceData.GetCommitteeMemberInitialByType&lt;ChairmanAssistant&gt;"> 
        <Then> 
          <Line align="Right">______________________    _________________________________________</Line> 
        </Then> 
        <Else> 
          <Line align="Right">{$ElectionManager.SourceData.GetCommitteeMemberInitialByType&lt;ChairmanAssistant&gt;}
________________________________________</Line> 
        </Else> 
      </If> 
      <Line align="Left">–°–µ–∫—Ä–µ—Ç–∞—Ä—å –∫–æ–º–∏—Å—Å–∏–∏</Line> 
      <If not="true" condition="ElectionManager.SourceData.GetCommitteeMemberInitialByType&lt;Secretary&gt;"> 
        <Then> 
          <Line align="Right">______________________    _________________________________________</Line> 
        </Then> 
        <Else> 
          <Line align="Right">{$ElectionManager.SourceData.GetCommitteeMemberInitialByType&lt;Secretary&gt;}    _________________________________________</Line> 
        </Else> 
      </If> 
      <Line align="Left">–ß–ª–µ–Ω—ã –∫–æ–º–∏—Å—Å–∏–∏:</Line> 
            <Line align="Right">______________________    _________________________________________</Line> 
      <Line align="Right">______________________    _________________________________________</Line> 
      <Line align="Right">______________________    _________________________________________</Line> 
      <Line align="Right">______________________    _________________________________________</Line> 
      <Line align="Right">______________________    _________________________________________</Line> 
      <Line align="Right">______________________    _________________________________________</Line> 
      <Line align="Right">______________________    _________________________________________</Line> 
      <Line align="Right">______________________    _________________________________________</Line> 
      <Line align="Right">______________________    _________________________________________</Line> 
      <Line align="Right">______________________    _________________________________________</Line> 
      <Line align="Right">______________________    _________________________________________</Line> 
      <Line align="Right">______________________    _________________________________________</Line> 
      <Line align="Right">______________________    _________________________________________</Line> 
      <Line align="Left"/> 
            <Line align="Left" bold="true">    –ú–ü       –ü—Ä–æ—Ç–æ–∫–æ–ª –ø–æ–¥–ø–∏—Å–∞–Ω "___" _____ {$CurrentDateTime.Year} –≥–æ–¥–∞   –≤ ___ —á–∞—Å–æ–≤ ___ –º–∏–Ω—É—Ç</Line> 
    </PageFooter> 
    <Footer> 
            <Line align="Left">–°–≤–µ–¥–µ–Ω–∏—è –æ –∫–æ–ª–∏—á–µ—Å—Ç–≤–µ –ø–æ—Å—Ç—É–ø–∏–≤—à–∏—Ö –≤ —É—á–∞—Å—Ç–∫–æ–≤—É—é –∏–∑–±–∏—Ä–∞—Ç–µ–ª—å–Ω—É—é –∫–æ–º–∏—Å—Å–∏—é –≤ –¥–µ–Ω—å –≥–æ–ª–æ—Å–æ–≤–∞–Ω–∏—è –∏ –¥–æ –æ–∫–æ–Ω—á–∞–Ω–∏—è   __________
________________________</Line> 
            <Line align="Left">–ø–æ–¥—Å—á–µ—Ç–∞ –≥–æ–ª–æ—Å–æ–≤ –∏–∑–±–∏—Ä–∞—Ç–µ–ª–µ–π –∂–∞–ª–æ–± (–∑–∞—è–≤–ª–µ–Ω–∏–π), –ø—Ä–∏–ª–∞–≥–∞–µ–º—ã—Ö –∫ –ø—Ä–æ—Ç–æ–∫–æ–ª—É                                                                   —Ü–∏—Ñ—Ä–∞–º–∏
ø—Ä–æ–ø–∏—Å—å—é</Line> 
    </Footer> 
</ReportTemplate>
