<?xml version="1.0" encoding="utf-8"?> 
<ReportTemplate font="Verdana" font-size="8" claspFooter="true" name="SourceData" restriction="Scanner.Voting.HasSourceData" 
                margin-left="15" margin-top="20" margin-right="25" margin-bottom="30" 
                  xmlns:xsi="http://www.w3.org/2001/XMLSchema-instance" 
                  xmlns="http://localhost/Schemas/SIB2003/ReportTemplate" 
                  xsi:schemaLocation="http://localhost/Schemas/SIB2003/ReportTemplate ReportTemplate.xsd"> 
  <Parameters> 
    <Parameter>SourceData</Parameter> 
    <Parameter>UIK</Parameter> 
  </Parameters> 
  <Header> 
    <Line fontSize="+2" bold="true" italic="false" align="Center">Исходные данные для УИК N {$@UIK}</Line> 
    <Line>Состав УИК: {$ScannersInfo.GetScannerInfos}</Line> 
    <If condition="@SourceData.IsReal"> 
      <Else> 
        <Line>ТРЕНИРОВОЧНЫЙ РЕЖИМ</Line> 
      </Else> 
    </If> 




    <Line>СКАНЕР N {$ScannersInfo.LocalScannerSerialNumber}</Line> 
    <Line>ДАТА ГОЛОСОВАНИЯ: {$@SourceData.ElectionDate|dd.MM.yyyy}</Line> 
    <Line>ДАННЫЕ ПРЕДНАЗНАЧЕНЫ ДЛЯ УИК: {$@SourceData.Targets|0000|Num}</Line> 
    <Line>КОЛИЧЕСТВО ТИПОВ БЮЛЛЕТЕНЕЙ: {$@SourceData.Blanks.Length}</Line> 
    <Line>ПОСЛЕДОВАТЕЛЬНОСТЬ СМЕНЫ РЕЖИМОВ: {$@SourceData.Modes}</Line> 


    <If condition="@SourceData.VotingModeTimes"> 
      <Then> 
        <Line>{$TAB}Время начала стационарного режима: {$@SourceData.MainVotingStartTime|t}</Line> 
        <Line>{$TAB}Время окончания стационарного режима: {$@SourceData.MainVotingEndTime|t}</Line> 
      </Then> 
    </If> 
    <If condition="@SourceData.CommitteeMembers"> 
      <Then> 
        <Line>СОСТАВ ЧЛЕНОВ УЧАСТКОВОЙ ИЗБИРАТЕЛЬНОЙ КОМИССИИ</Line> 
        <For each="Member" in="@SourceData.CommitteeMembers"> 
          <Body> 
            <If condition="@Member.LastName"> 
              <Then> 
                <Line> 
                  <Parts> 
                    <Part>{$TAB}{$TAB}{$TAB}{$@Member.Type|t}: </Part> 
                    <Part condition="@Member.LastName">{$@Member.LastName|#u}</Part> 
                    <Part condition="@Member.FirstName"> {$@Member.FirstName}</Part> 
                    <Part condition="@Member.Patronymic"> {$@Member.Patronymic}</Part> 
                  </Parts> 
                </Line> 
              </Then> 
            </If> 
            <If condition="@Member.LastName"> 
              <Else> 
                <Line> 
                  <Parts> 
                    <Part>{$TAB}{$TAB}{$TAB}{$@Member.Type|t}: </Part> 
                    <Part>ФИО НЕ ЗАДАНО</Part> 
                  </Parts> 
                </Line> 
              </Else> 
            </If> 
          </Body> 
        </For> 
      </Then> 
    </If> 
    <Line>БЮЛЛЕТЕНИ:</Line> 


    <For each="Blank" in="@SourceData.Blanks"> 
      <Body> 
        <Line>{$TAB}БЮЛЛЕТЕНЬ N {$@Blank.Id}</Line> 
        <Line>{$TAB}{$TAB}ВЫБОРЫ: {$@Blank.Elections}</Line> 
      </Body> 
    </For> 
    <Line>ВЫБОРЫ:</Line> 
    <For each="Election" in="@SourceData.Elections"> 
      <Body> 
        <Line>{$TAB}{$@Election.@Current}. {$@Election.Name}</Line> 
        <Line>{$TAB}{$TAB}РЕЖИМЫ ГОЛОСОВАНИЯ: {$@Election.Modes}</Line> 
        <Line condition="@Election.StampCommittees">{$TAB}{$TAB}НОМЕРА ВЫШЕСТОЯЩИХ КОМИССИЙ: {$@Election.StampCommittees|0000|Num}</Line> 
        <Line>{$TAB}{$TAB}ЧИСЛО МАНДАТОВ: {$@Election.MaxMarks}</Line> 
        <If condition="@Election.NoneAboveExists"> 
          <Then> 
            <Line>{$TAB}{$TAB}НАЛИЧИЕ ОТМЕТКИ "ПРОТИВ ВСЕХ": {$@Election.NoneAboveExists}</Line> 
          </Then> 
        </If> 
        <Line>{$TAB}{$TAB}ЧИСЛО ПОЗИЦИЙ: {$@Election.Candidates.Length}</Line> 
        <Line>{$TAB}{$TAB}ПОЗИЦИИ:</Line> 
        <For each="Candidate" in="@Election.Candidates"> 
          <Body> 
            <Line> 
              <Parts> 
                <Part>{$TAB}{$TAB}{$TAB}{$@Candidate.@Current}. </Part> 
                <Part condition="@Candidate.LastName">{$@Candidate.LastName|#u}</Part> 
                <Part condition="@Candidate.FirstName"> {$@Candidate.FirstName}</Part> 
                <Part condition="@Candidate.Patronymic"> {$@Candidate.Patronymic}</Part> 
                <Part condition="@Candidate.DisabledInSourceData"> (позиция снята)</Part> 
                <Part condition="@Candidate.DisabledLocally"> (позиция снята на УИК)</Part> 
              </Parts> 
            </Line> 
          </Body> 
        </For> 
        <Line>{$TAB}{$TAB}НАИМЕНОВАНИЕ ПРОТОКОЛА: {$@Election.Protocol.Name}</Line> 
        <If condition="@Election.Protocol.DisabledString"> 
          <Then> 
            <Line>{$TAB}{$TAB}СТРОКА ДЛЯ СНЯТЫХ ПОЗИЦИЙ: {$@Election.Protocol.DisabledString}</Line> 
          </Then> 
          <Else> 
            <Line>{$TAB}{$TAB}СНЯТЫЕ ПОЗИЦИИ НЕ ВКЛЮЧАЮТСЯ В ОТЧЕТ</Line> 
          </Else> 
        </If> 
        <If condition="@Election.Protocol.Lines"> 
          <Then> 
            <Line>{$TAB}{$TAB}СТРОКИ ПРОТОКОЛА:</Line> 
            <For each="Line" in="@Election.Protocol.Lines"> 
              <Body> 
                <Line>{$TAB}{$TAB}{$TAB}{$@Line.Num}{$@Line.AdditionalNum}. {$@Line.Name}. ({$@Line.Type})</Line> 
              </Body> 
            </For> 
          </Then> 
          <Else> 
            <Line>{$TAB}{$TAB}СТРОКИ ПРОТОКОЛА: НЕТ</Line> 
          </Else> 
        </If> 
        <If condition="ElectionManager.NeedExecuteCheckExpressions"> 
          <Then> 
            <Line/> 
            <Line>{$TAB}{$TAB}КОНТРОЛЬНЫЕ СООТНОШЕНИЯ:</Line> 
            <For each="Check" in="@Election.Protocol.Checks"> 
              <Body> 
                <Line condition="@Check.Enabled"> 
                  <Parts> 
                    <Part>{$TAB}{$TAB}{$TAB}</Part> 
                    <Part condition="@Check.Mild"> 
                      <Parts> 
                        <Part>[ЛОГИЧЕСКОЕ] </Part> 
                      </Parts> 
                    </Part> 
                    <Part>{$@Check.GetExpansion&lt;$@Election.Protocol&gt;}</Part> 
                  </Parts> 
                </Line> 
              </Body> 
            </For> 
          </Then> 
          <Else> 
            <Line>{$TAB}{$TAB}КОНТРОЛЬНЫЕ СООТНОШЕНИЯ: НЕТ</Line> 
          </Else> 
        </If> 
        <Line/> 
      </Body> 
    </For> 
  </Header> 
  <PageFooter> 
    <Line align="Left">Председатель участковой избирательной комиссии</Line> 
    <If not="true" condition="@SourceData.GetCommitteeMemberInitialByType&lt;Chairman&gt;"> 
      <Then> 
        <Line align="Right">______________________    _________________________________________</Line> 
      </Then> 
      <Else> 
        <Line align="Right">{$@SourceData.GetCommitteeMemberInitialByType&lt;Chairman&gt;}  _________________________________________</Line> 
      </Else> 
    </If> 
    <Line align="Right">(фамилия, инициалы)                       (подпись либо причина отсутствия,      </Line> 
    <Line align="Right">                                     отметка об особом мнении)           </Line> 
    <Line align="Left">Заместитель председателя комиссии</Line> 
    <If not="true" condition="@SourceData.GetCommitteeMemberInitialByType&lt;ChairmanAssistant&gt;"> 
      <Then> 
        <Line align="Right">______________________    _________________________________________</Line> 
      </Then> 
      <Else> 
        <Line align="Right">{$@SourceData.GetCommitteeMemberInitialByType&lt;ChairmanAssistant&gt;}  _________________________________________</Line> 
      </Else> 
    </If> 
    <Line align="Left">Секретарь комиссии</Line> 
    <If not="true" condition="@SourceData.GetCommitteeMemberInitialByType&lt;Secretary&gt;"> 
      <Then> 
        <Line align="Right">______________________    _________________________________________</Line> 
      </Then> 
      <Else> 
        <Line align="Right">{$@SourceData.GetCommitteeMemberInitialByType&lt;Secretary&gt;}  _________________________________________</Line> 
      </Else> 
    </If> 
  </PageFooter> 
</ReportTemplate>
